train582	港澳 通行证 团签 可以 其所 意志 出行 吗	19
train583	你好 请问 广汉 港澳 通行证 团签 可以 改行 个人 签 吗	19
train584	观光 居留	19
train585	广元 户口 办 港澳 通行证 可以 新 政策 吗	19
train586	旅游者	19
train587	请问 我 办理 了 港澳 的 入境 但是 我 户口 在 长宁 只能 办 团队 的 可是 我直 飞机票 都 买好 了 不能 后退 请问 可以 改用 个人 的 么	19
train588	我办 了 粤港 通行证 但是 只 手续 了 香港 的 现在 就让 手续 澳门 的 可以 吗	19
train589	我办 港澳 通行证 是 申报 的 各种类型 是 个人 怎么办 下来 各种类型 是 一个 团队 旅游 啊	19
train590	持有 成都市 居住证 办理 港澳 通行证 请问 是 个人 旅游区 签 还是 团队 旅游区 签	19
train591	要来 有 港澳 通行证 在 川 内办 的 但是 没有 签注 过 户口 是 上 大学 期间 迁 到 成都 的 能 签 个人 游 吗	19
train592	办理 粤港 通行证 时筹 的 是 团签 如何 改成 个人 旅游 签注 呢 谢谢	19
train598	澳门 人 通行证 陕西 宜宾市 高镇 那边 默认 的 种类 是 团队 生态旅游 L 公司 让 过去 公干 成都 飞 香港 昨天 能 在 成都 入境 哪里 受理 团队 改 个人 吗 急急 急	19
train599	老公 在 老家 办理 了 港澳 通行证 签注 勉强 做 L 团签 那 时候 户口 迁 到 成都 了 是否 可以 办理 个人身份 旅游 签注 必须 什么 均 须 妳	19
train600	海外 户籍 办 的 港澳 通行证 繁多 是 团队 旅游者 从 成都双流机场 出境 到 香港 是 直接 凭 港澳 通行证 的 有效 签注 出境 就 好 了 还是 必须 要 跟 旅游团 带 的	19
train601	为什么 不 回答 我 的 问题 我 都 问 了 三次 了 我 港澳台 才 可 在 四川 达州 办 的 昨晚 在 四川 证件 的 从 四川 直航 香港 出差 请问 还 能够 办理 团签 吗	19
train602	你好 答道 一下 我 是 昆明 的 办理 的 粤港 通行证 是 团队 旅游 L 是不是 必须 只有 跟团 才能 去	19
train603	我 在 重庆市 但是 所在 的 区县 不能 受理 应有 旅游 在 主城 可以 受理 吗	19
train604	逐日 是 凉山州 西昌市 中港 通行证 也 是 在 康定 交 的 现在 提出申请 了 成都 的 居住证 中港 通行证 能 签注 个人 旅游者 G 吗 还是 只能 签注 团队 旅游者 L	19
train605	不是 原先 户籍 本地人	20
train606	不是 啊	20
train607	嗯 不是 这样	20
train608	不	20
train609	必定	20
train610	我 不是 泸州 的	20
train611	哎 不是	20
train612	不是 那	20
train613	不 可以	20
train614	不是	20
train615	不 对	20
train616	不是 啊 啊	20
train617	我 却说 不是	20
train618	给 你 说 是不是	20
train619	不是 首次 那里	20
train625	不是 昆明 流动人口	20
train626	从未	20
train627	不是 不是 打 出去	20
train628	没有	20
train629	不 对 的	20
train630	没 啦	20
train631	快递 核查 售价	21
train632	送货 证件 怎么 可知	21
train633	寄发 回乡证 多少 钱	21
train634	邮寄 证件 HK 规格	21
train635	电脑游戏 额度	21
train636	Pardosa 证件 廉宜 么	21
train637	同 城东 速递 多少 钱	21
train638	邮寄 签注 票价 基准	21
train639	递送 花费 怎么 算 呀	21
train640	寄给 证件 廉价 么	21
train641	快递 费用 极高 么	21
train642	Pardosa 取证 收费 准则	21
train643	收件 身份证件 贵不贵 呀	21
train644	寄发 身份证 价格 标准	21
train645	游戏 费用 怎么 输 啊	21
train651	投递 取证 低价 么	21
train652	游戏 经费 怎么 可知 的	21
train653	收件 证件 怎么 付费	21
train654	寄送 费用 怎么 而今 呀	21
train655	速递 取证 怎么 不算	21
train656	递送 支出 怎么 算	21
train657	怎么 费率 怎么 而今	21
train658	快递 通行证 车资 标准	21
train659	新 武器 额度 多少	21
